{
  "appHost": {
    "path": "AppHost.java",
    "language": "java"
  },
  "features": {
    "experimentalPolyglot:java": true
  },
  "packages": {
    "Aspire.Hosting.Azure.AppConfiguration": ""
  },
  "profiles": {
    "https": {
      "applicationUrl": "https://localhost:29550;http://localhost:28731",
      "environmentVariables": {
        "ASPIRE_DASHBOARD_OTLP_ENDPOINT_URL": "https://localhost:10775",
        "ASPIRE_RESOURCE_SERVICE_ENDPOINT_URL": "https://localhost:13119"
      }
    }
  }
}
