{
  "appHost": {
    "path": "AppHost.java",
    "language": "java"
  },
  "features": {
    "experimentalPolyglot:java": true
  },
  "packages": {
    "Aspire.Hosting.Kubernetes": ""
  },
  "profiles": {
    "https": {
      "applicationUrl": "https://localhost:29650;http://localhost:28831",
      "environmentVariables": {
        "ASPIRE_DASHBOARD_OTLP_ENDPOINT_URL": "https://localhost:10875",
        "ASPIRE_RESOURCE_SERVICE_ENDPOINT_URL": "https://localhost:13219"
      }
    }
  }
}
